{"tool":"autoresearch","action":"experiment_done","status":"success","details":{"status":"discard","metric":"bench_score","value":86.82,"prev":100.0,"delta":-13.18,"commit":"695edfd","description":"FTS OR semantics all tokens — recall 1.000 but p50 88ms","tag":"jul02"},"local_time":"2026-07-02T17:32:58"}
{"tool":"autoresearch","action":"experiment_done","status":"success","details":{"status":"discard","metric":"bench_score","value":97.22,"prev":100.0,"delta":-2.78,"commit":"5fa48de","description":"FTS OR longest-6-token cap — recall 1.000, p50 49.2ms","tag":"jul02"},"local_time":"2026-07-02T17:34:14"}
{"tool":"autoresearch","action":"experiment_done","status":"success","details":{"status":"discard","metric":"bench_score","value":94.12,"prev":100.0,"delta":-5.88,"commit":"19405da","description":"FTS OR longest-4-token cap — machine noise, slower than 6-cap","tag":"jul02"},"local_time":"2026-07-02T17:35:28"}
{"tool":"autoresearch","action":"experiment_done","status":"success","details":{"status":"keep","metric":"bench_score","value":104.87,"prev":100.0,"delta":4.87,"commit":"fe32deb","description":"cached search DB connection — p50 38.5→33.1ms, tests pass (2 pre-existing fails)","tag":"jul02"},"local_time":"2026-07-02T17:39:27"}
{"tool":"autoresearch","action":"experiment_done","status":"success","details":{"status":"discard","metric":"bench_score","value":101.3,"prev":104.87,"delta":-3.57,"commit":"28655e4","description":"FTS OR 6-cap + half-limit — recall 1.000 but net score below exp4 state","tag":"jul02"},"local_time":"2026-07-02T17:41:08"}
{"tool":"autoresearch","action":"experiment_done","status":"success","details":{"status":"keep","metric":"bench_score","value":135.17,"prev":104.87,"delta":30.3,"commit":"4fd6799","description":"int8 quantization dual-dtype — recall unchanged, p50 33→25.6ms, new-DB size -50%, tests 229/231 (2 pre-existing)","tag":"jul02"},"local_time":"2026-07-02T17:53:24"}
{"tool":"autoresearch","action":"experiment_done","status":"success","details":{"status":"keep","metric":"bench_score","value":143.57,"prev":135.17,"delta":8.4,"commit":"012f5d1","description":"query embedding LRU memo — score partly bench artifact (2-pass memo hit); real value = MCP double-embed elimination, verified 0.00ms hit + identical output","tag":"jul02"},"local_time":"2026-07-02T17:56:24"}
{"tool":"autoresearch","action":"experiment_done","status":"success","details":{"status":"keep","metric":"bench_score","value":125.99,"prev":135.9,"delta":-9.91,"commit":"pending","description":"work-recheck: FTS OR reapplied — user goal accuracy-improvement overrides composite metric weighting; recall 0.930→1.000, p50 ~35ms still under 38.5 baseline","tag":"jul02"},"local_time":"2026-07-02T18:30:48"}
